{
  "schema_version": 2,
  "run_id": "2026-01-01_000000",
  "timestamp": "2026-01-01T00:00:00Z",
  "status": "fail",
  "summary": "status=fail findings: fail=1 warn=0 info=0",
  "findings": [
    {
      "id": "artifact_1",
      "severity": "fail",
      "kind": "missing",
      "artifact_path": "library/exports/example.wav",
      "title": "MISSING: library/exports/example.wav",
      "why": "missing artifact",
      "fix": "service: assets.export_all anchors_pack=shared/specs/automation/anchors/<pack_id> overwrite=true",
      "details": {"kind": "rack", "bytes": ""}
    }
  ],
  "reasons": ["missing: library/exports/example.wav"],
  "recommended_fixes": [
    {
      "id": "fix_1",
      "command": "service: assets.export_all anchors_pack=shared/specs/automation/anchors/<pack_id> overwrite=true",
      "covers": ["library/exports/example.wav"],
      "notes": "Rebuild missing artifacts"
    }
  ]
}
